{
  "apiVersion": "agent.delivery.loop/v0",
  "kind": "Demand",
  "metadata": {
    "id": "demand-mind-palace-health-20260629",
    "title": "Maintain Mind Palace wiki health",
    "created_at": "2026-06-29T00:00:00+08:00"
  },
  "spec": {
    "requester": {
      "kind": "human",
      "id": "requester-example"
    },
    "request": "Keep the Mind Palace wiki healthy and propose next maintenance steps without uncontrolled live mutation.",
    "success_criteria": [
      "Survey smoke succeeds",
      "Lint report succeeds",
      "Index proposals remain evidence-linked and approval-gated"
    ],
    "budget": {
      "token_limit": 120000,
      "token_used_estimate": 0,
      "max_iterations": 8,
      "max_tasks": 20,
      "stop_when_remaining_below": 15000,
      "time_limit_seconds": null,
      "escalation": "ask_requester"
    },
    "permissions": {
      "docs_write": false,
      "delete_move_archive": false,
      "cron_mutation": false,
      "workflow_mutation": false,
      "profile_mutation": false,
      "external_send": true,
      "code_write": false,
      "shell_exec": false
    }
  }
}
